<?xml version="1.0" encoding="UTF-8"?>
<!-- IMPLICIT DTD -->
<!DOCTYPE SignUp [
<!ELEMENT SignUp (User+)>
<!ELEMENT User (Name,Email,Phone,Password,ConfirmPassword)>
<!ELEMENT Name (#PCDATA)>
<!ELEMENT Email (#PCDATA)>
<!ELEMENT Phone (#PCDATA)>
<!ELEMENT Password (#PCDATA)>
<!ELEMENT ConfirmPassword (#PCDATA)>
<!ATTLIST User id ID (#REQUIRED)>
]>
<!-- 
EXPLICIT DTD
<!DOCTYPE SignUp SYSTEM "signup.dtd"> 
-->
<SignUp xmlns="http://www.signup.com"
xmlns:xsi="http://www.w3.org/2001/XMLSchema-instance"
xsi:schemaLocation="http://www.signup.com signup.xsd">
    <User id="maheshv123">
        <Name>Mahesh</Name>
        <Email>Mahesh23042002@gmail.com</Email>
        <Phone>6384803545</Phone>
        <Password>Password123</Password>
        <ConfirmPassword>Password123</ConfirmPassword>
    </User>
    <User id="mahsh123">
        <Name>Mahesh1</Name>
        <Email>Mahesh1l123@gmail.com</Email>
        <Phone>6384803548</Phone>
        <Password>Password012</Password>
        <ConfirmPassword>Password012</ConfirmPassword>
    </User>
    <User id="vishal12345">
        <Name>Mahesh2</Name>
        <Email>vishal12345@gmail.com</Email>
        <Phone>4353455435</Phone>
        <Password>PassWord</Password>
        <ConfirmPassword>PassWord</ConfirmPassword>
    </User>
</SignUp>